{"componentChunkName":"component---src-components-project-page-tsx","path":"/projects/Boynton/","result":{"data":{"mdx":{"id":"8d9d4dca-777a-5ce6-99a9-543985c03fed","body":"function _extends() { _extends = Object.assign || function (target) { for (var i = 1; i < arguments.length; i++) { var source = arguments[i]; for (var key in source) { if (Object.prototype.hasOwnProperty.call(source, key)) { target[key] = source[key]; } } } return target; }; return _extends.apply(this, arguments); }\n\nfunction _objectWithoutProperties(source, excluded) { if (source == null) return {}; var target = _objectWithoutPropertiesLoose(source, excluded); var key, i; if (Object.getOwnPropertySymbols) { var sourceSymbolKeys = Object.getOwnPropertySymbols(source); for (i = 0; i < sourceSymbolKeys.length; i++) { key = sourceSymbolKeys[i]; if (excluded.indexOf(key) >= 0) continue; if (!Object.prototype.propertyIsEnumerable.call(source, key)) continue; target[key] = source[key]; } } return target; }\n\nfunction _objectWithoutPropertiesLoose(source, excluded) { if (source == null) return {}; var target = {}; var sourceKeys = Object.keys(source); var key, i; for (i = 0; i < sourceKeys.length; i++) { key = sourceKeys[i]; if (excluded.indexOf(key) >= 0) continue; target[key] = source[key]; } return target; }\n\n/* @jsxRuntime classic */\n\n/* @jsx mdx */\nvar _frontmatter = {\n  \"title\": \"Boynton\",\n  \"emoji\": \"ðŸŒ²\",\n  \"description\": \"Summer Camp elective sign-up and attendance mangagment with Slack integration\",\n  \"tags\": [\"react\", \"javascript\", \"postgres\", \"slack\", \"google\", \"camp\"],\n  \"code\": \"http://github.com/knapptr/boynton\",\n  \"example\": null,\n  \"published\": false,\n  \"date\": \"2022-09-13T00:00:00.000Z\"\n};\nvar layoutProps = {\n  _frontmatter: _frontmatter\n};\nvar MDXLayout = \"wrapper\";\nreturn function MDXContent(_ref) {\n  var components = _ref.components,\n      props = _objectWithoutProperties(_ref, [\"components\"]);\n\n  return mdx(MDXLayout, _extends({}, layoutProps, props, {\n    components: components,\n    mdxType: \"MDXLayout\"\n  }), mdx(\"h2\", null, \"Solving a problem\"), mdx(\"h3\", null, \"The problem:\"), mdx(\"p\", null, \"At \", mdx(\"a\", {\n    parentName: \"p\",\n    \"href\": \"http://www.campleslie.org\"\n  }, \"Camp Leslie\"), \" our campers sign up for activities shortly after drop-off. In the past, all sign ups were done on paper. After a counselor finished signing up all their campers, the list would be brought to the office, where a member of our admin staff would begin transferring names to attendance lists. Once we had populated all the attendance lists we would then schedule staffing to meet adequate camper:staff ratios in each activity. On average, the entire process took about 4 hours - with the primary bottleneck being the collection of sign-ups, and the population of attendance lists. \"), mdx(\"p\", null, \"Further, attendace lists were printed each day, and used by staff in each activity to ensure that all campers were accounted for. Communcation about attendance status was made over 2 way radio. The attendance taking process took up a considerable amount of time- not to mention if campers were moved to a new activity, the attendance sheets were no longer correct. Other than radio communication, admin staff (and other activities) had no real way of knowing how the process was going. \"), mdx(\"h3\", null, \"The solution:\"), mdx(\"p\", null, \"What if campers were signed-up on a counselor's phone? The list of campers in each activity would already be populated, and even if a counselor had not signed up all their campers, lists would be mostly populated for attendance. Then, what if the lists for attendance were shared, with updates to lists happening live? The admin team would be able to closely coordinate between activities, as all attendance records are shared. Further, attendance sheets would be up-to-date in the event that a camper needed to switch activities. What if this software solution also had Slack integration, to facilitate other common camp workflow bottlenecks? \"), mdx(\"h2\", null, \"Development\"), mdx(\"p\", null, \"This felt like a huge project. The initial idea was to create lists of campers who won awards during the week. However, once a database of enrolled campers was created, it really opened up a lot of options. In retrospect, I wish I had used Typescript for this- the development experience would have been greatly improved. I did my best to follow a TDD workflow, but did have a tough time implementing tests for the PG interaction.\\n\", mdx(\"img\", {\n    parentName: \"p\",\n    \"src\": \"/a8181e387d5db9097eb1067d8c448142/cabin-assignment.gif\",\n    \"alt\": \"Assigning Cabins with 'Boynton'\"\n  })), mdx(\"h2\", null, \"Deployment\"), mdx(\"p\", null, \"Deploying this was stressful, because it was the first time I was planning on having software I had developed be 'mission critical'. If it didn't work, we could always fall back to the tried and true pen and paper method- but nevertheless I was really banking on having all systems go for the summer of 2022.\\n\", mdx(\"img\", {\n    parentName: \"p\",\n    \"src\": \"/e787094bb19d250f3ba5e773afbf3754/activity-signup.gif\",\n    \"alt\": \"Signing up for activities\"\n  })), mdx(\"h2\", null, \"Results\"), mdx(\"p\", null, \"'Boynton' was a rousing success. There were some initial bugs due to the need to trim and sanitize inputs, but this were easy to fix quickly, and easy to identify from the start. The app did crash 1-2 times during the summer, but the bugs were obvious, and patches were made within minutes. It is probably helpful to have the primary user of the service also be the developer... 'Boynton' saved myself and the camp staff countless hours of work this summer. The staff response has been overwhelmingly positive.\\n\", mdx(\"img\", {\n    parentName: \"p\",\n    \"src\": \"/21a9b4e311b122d7f4fd529707992900/attendance.gif\",\n    \"alt\": \"Taking attendance\"\n  })), mdx(\"h2\", null, \"Follow-through plans\"), mdx(\"p\", null, \"I'm excited to continue development on this project. I'd like to move the code slowly over to Typescript, and would like to clean up the deployment process. I would also like to add some more administrator features- but on the whole I'm very happy with where things are at, and how extensible I believe the app will be.\"));\n}\n;\nMDXContent.isMDXComponent = true;","frontmatter":{"title":"Boynton","tags":["react","javascript","postgres","slack","google","camp"],"description":"Summer Camp elective sign-up and attendance mangagment with Slack integration","emoji":"ðŸŒ²","code":"http://github.com/knapptr/boynton","example":null}}},"pageContext":{"id":"8d9d4dca-777a-5ce6-99a9-543985c03fed"}},"staticQueryHashes":["3649515864"]}